id,name,image_url,gender,biography,birthday,instagram_url,twitter_url,country_id,created_at
134,Josh Duhamel,https://www.themoviedb.org/t/p/w300_and_h450_bestv2/5Rp9aeWdN2S623KCjwfii9MhDK1.jpg,1,"Joshua David Duhamel (born November 14, 1972) is an American actor and former fashion model. After various modeling work, he made his acting debut as Leo du Pres on the ABC daytime soap opera All My Children and later starred as Danny McCoy on NBC's Las Vegas.

Duhamel has ventured into film, appearing as one of the main protagonists in four of the Transformers films, most recently in the fifth entry, Transformers: The Last Knight (2017)",1972-11-14,https://instagram.com/joshduhamel/,https://twitter.com/joshduhamel,1,2023-02-04 08:57:15.730077+00
135,Titus Welliver,https://www.themoviedb.org/t/p/w300_and_h450_bestv2/3hTwn7Maktr6ONq1VvfqyRacjiv.jpg,1,"Titus Welliver is an American painter, stage and screen actor, best known for his leading role as Harry Bosch in the Amazon series ""Bosch"".",1961-03-12,https://instagram.com/wellivert/,https://twitter.com/welliver_titus,1,2023-02-04 08:57:56.330625+00
136,François Berléand,https://www.themoviedb.org/t/p/w300_and_h450_bestv2/5TDYSUfCj8vaG5sqJXUU06Cvafa.jpg,1,"Berléand was born in Paris, France of Armenian descent. He plays Gilles Triquet, the officer manager and equivalent of David Brent in Le Bureau, the French version of The Office, produced by Canal+. He released a book about his childhood in 2006, Le fils de l'homme invisible (The son of the invisible man). He also appeared in the 2002 movie The Transporter as the French inspector named Tarconi, an active and honest police officer who is an acquaintance of Frank Martin (Jason Statham). He reprised the role in the sequels Transporter 2 and Transporter 3.",1952-04-22,,,19,2023-02-06 02:40:15.494454+00
137,Ben Foster,https://www.themoviedb.org/t/p/w300_and_h450_bestv2/4le1PMWTGp7y2IBmZEIOHfE3HAB.jpg,1,"Ben Foster (born October 29, 1980) is an American actor. His film roles include The Laramie Project, Liberty Heights, Get Over It, Hostage, X-Men: The Last Stand, Alpha Dog, 30 Days of Night, The Messenger, Bang Bang You're Dead and Pandorum. He received best supporting actor nominations from both the Saturn and Satellite Awards for his 2007 role in the film 3:10 to Yuma.",1980-10-29,,,1,2023-02-06 02:46:57.31096+00
138,Sylvester Stallone,https://www.themoviedb.org/t/p/w300_and_h450_bestv2/qDRGPAcQoW8Wuig9bvoLpHwf1gU.jpg,1,"Sylvester Stallone (born Michael Sylvester Gardenzio Stallone, July 6, 1946) is an American actor and filmmaker. After his beginnings as a struggling actor for a number of years upon arriving to New York City in 1969 and later Hollywood in 1974, he won his first critical acclaim as an actor for his co-starring role as Stanley Rosiello in The Lords of Flatbush.",1946-07-06,https://instagram.com/officialslystallone/,https://twitter.com/TheSlyStallone,1,2023-02-06 02:54:29.289122+00
139,Jean-Claude Van Damme,https://www.themoviedb.org/t/p/w300_and_h450_bestv2/7DP3bm3MS0qa0L8tBLHGebbCu6H.jpg,1,"Van Damme was born Jean-Claude Camille François van Varenberg in Berchem-Sainte-Agathe, Brussels, Belgium, to Eliana and Eugène van Varenberg, an accountant. “The Muscles from Brussels” started martial arts at the age of eleven. His father introduced him to martial arts when he saw his son was physically weak. At the age of 12, van Damme began his martial arts training at Centre National De Karate (National Center of Karate) under the guidance of Master Claude Goetz in Ixelles, Belgium. Van Damme trained for 4 years and earned a spot on the Belgium Karate Team. He won the European professional karate association's middleweight championship as a teenager, and also beat the 2nd best karate fighter in the world. His goal was to be number one but got sidetracked when he left his hometown of Brussels.",1960-10-18,https://instagram.com/jcvd/,https://twitter.com/JCVD,26,2023-02-06 03:01:19.368778+00
140,Arnold Schwarzenegger,https://www.themoviedb.org/t/p/w300_and_h450_bestv2/zEMhugsgXIpnQqO31GpAJYMUZZ1.jpg,1,"Arnold Alois Schwarzenegger (born July 30, 1947) is an Austrian-American actor, film producer, businessman, former bodybuilder and politician who served as the 38th governor of California (2003-2011). As of 2022, he is the most recent Republican governor of California. Time magazine named Schwarzenegger one of the 100 most influential people in the world in 2004 and 2007. He also served as Chairman of the President's Council on Physical Fitness and Sports (1990-1993).",1947-07-30,https://instagram.com/schwarzenegger/,https://twitter.com/Schwarzenegger,25,2023-02-06 03:02:35.868593+00
141,Sung Kang,https://www.themoviedb.org/t/p/w300_and_h450_bestv2/jCrjAt7L1SO4TOC0O6Nr7ZZU8vS.jpg,1,"Kang was born in Gainesville, Georgia, to South Korean immigrant parents and spent his adolescence in California. He attended the University of California, Riverside. While in college he chose acting over law school, a decision which was met with disappointment from his parents due to their concerns over the lack of Asians on American television and lack of job prospects.",1972-04-08,,https://twitter.com/sungkang,1,2023-02-06 03:39:46.516408+00
142,Lucas Black,https://www.themoviedb.org/t/p/w300_and_h450_bestv2/w2oImwC4Y0RDtyvaKGTCFCKsvwh.jpg,1,"Lucas York Black (born November 29, 1982) is an American film and television actor. He is known for his roles in the CBS television series American Gothic as well as roles in films such as Sling Blade, Jarhead, Friday Night Lights, The Fast and the Furious: Tokyo Drift, Legion and Get Low.",1982-11-29,,,1,2023-02-06 03:40:21.454248+00
143,Joe Taslim,https://www.themoviedb.org/t/p/w300_and_h450_bestv2/lv85qMVXtofw7VsM7tKR36V0jAy.jpg,1,"Johannes ""Joe"" Taslim is an Indonesian actor and martial artist of Chinese descent. A member of the Indonesia Judo national team from 1997 to 2009, Taslim is best known for his breakthrough role as ""Jaka"" in the critically acclaimed The Raid (2011). Later going on to play ""Jah"" in Fast & Furious 6 (2013), which marked his first role in a film outside Indonesia.",1981-06-23,https://instagram.com/joe_taslim/,https://twitter.com/joe_taslim,2,2023-02-06 03:49:38.355272+00
144,Jack Black,https://www.themoviedb.org/t/p/w300_and_h450_bestv2/rtCx0fiYxJVhzXXdwZE2XRTfIKE.jpg,1,"Thomas Jacob ""Jack"" Black (born August 28, 1969) is an American actor, comedian, musician, and songwriter. Black is known for his roles in the films High Fidelity (2000), Shallow Hal (2001), Orange County (2002), School of Rock (2003), Envy (2004), Gulliver's Travels (2010), Bernie (2011) and The House with a Clock in Its Walls (2018), in addition to his role in the Jumanji franchise. He also voices the giant panda named Po from DreamWorks Animation's Kung Fu Panda films. He gained Golden Globe nominations for his work in School of Rock and Bernie, and he was given a star on Hollywood's Walk of Fame in 2018.",1969-08-28,https://instagram.com/jackblack/,https://twitter.com/jackblack,1,2023-02-06 06:55:55.652847+00
145,Zac Efron,https://www.themoviedb.org/t/p/w300_and_h450_bestv2/6oXNHv7gAyXXYFpF943pKRsTtqQ.jpg,1,"Zachary David Alexander Efron (born October 18, 1987) is an American actor. He began acting professionally in the early 2000s and rose to prominence in the late 2000s for his leading role as Troy Bolton in the High School Musical trilogy (2006–2008). During this time, he also starred in the musical film Hairspray (2007) and the comedy film 17 Again (2009). Efron subsequently rose to mainstream prominence with starring roles in the films New Year's Eve (2011), The Lucky One (2012), The Paperboy (2012), Neighbors (2014), Dirty Grandpa (2016), Baywatch (2017), and The Greatest Showman (2017). He played Ted Bundy in Extremely Wicked, Shockingly Evil and Vile (2019). In 2021, he won a Daytime Emmy Award for the Netflix web documentary series Down to Earth with Zac Efron (2020–present).",1987-10-18,https://instagram.com/zacefron/,https://twitter.com/ZacEfron,1,2023-02-06 07:04:35.43102+00
146,Priyanka Chopra,https://www.themoviedb.org/t/p/w300_and_h450_bestv2/stEZxIVAWFlrifbWkeULsD4LHnf.jpg,1,"​Priyanka Chopra Jonas is an Indian actress and former Miss World. Before starting her acting career, she worked as a model and gained fame after winning the Miss World title in 2000. She is often referred to by the nickname “Piggy Chops”, which was given to her by co-stars on the set of the film Bluffmaster! Chopra made her acting debut with the 2002 Tamil film Thamizhan. The following year, she made her Bollywood film debut with The Hero: Love Story of a Spy and followed it with the hit Andaaz, for which she won a Filmfare Best Female Debut Award.",1982-07-18,https://instagram.com/priyankachopra/,https://twitter.com/priyankachopra,15,2023-02-06 07:05:40.997075+00
147,Aldis Hodge,https://www.themoviedb.org/t/p/w300_and_h450_bestv2/jPpnaAGFXaIeOrRNUHIHxk3fIJL.jpg,1,"Aldis Alexander Basil Hodge (born September 20, 1986) is an American actor best known for his role as Alec Hardison on the TNT series Leverage and as MC Ren in the 2015 biopic, Straight Outta Compton. Aldis is the younger brother of actor Edwin Hodge.

In 2007, Hodge was awarded the role of Alec Hardison on the day of his twenty-first birthday. In 2010, he received a Saturn Award nomination for Best Supporting Actor in Television for this role on Leverage.",1986-09-20,https://instagram.com/aldis_hodge/,https://twitter.com/AldisHodge,1,2023-02-06 07:12:20.610174+00
148,Keira Knightley,https://www.themoviedb.org/t/p/w300_and_h450_bestv2/8OpsaapXmwpLQqHvN5iwoIElERY.jpg,1,"Keira Christina Knightley (born 26 March 1985) is an English actress. She has starred in both independent films and big-budget blockbusters, and is particularly noted for her roles in period dramas. Her accolades include two Empire Awards and nominations for two Academy Awards, three British Academy Film Awards, three Golden Globe Awards, one Screen Actors Guild Award and one Laurence Olivier Award. Knightley was appointed an OBE in the 2018 Birthday Honours for services to drama and charity.",1985-03-26,,,3,2023-02-06 07:40:13.191861+00
149,Jai Courtney,https://www.themoviedb.org/t/p/w300_and_h450_bestv2/6vEaNwbOKov6yzQx15CdtrqfK3L.jpg,1,"Born March 15, 1986 in Sydney, Australia, Courtney and his sister were raised in Sydney's leafy northwest suburbs, attending Galston Public School where their mother, Karen, was a teacher. His father, Chris, was a civil servant with the state electricity company, implying that there were no show business influences in the family when Jai caught the acting bug as a 10-year-old. He went on to develop his dramatic skills at Cherrybrook Technology High School. At 18, Courtney, like many of Australia's finest thespians before him, tried and failed to win a place at the country's leading acting school, the National Academy for Dramatic Art (NIDA).",1986-03-15,https://instagram.com/jaicourtney/,https://twitter.com/JaiCourtney,5,2023-02-06 07:46:25.778759+00
150,Yayan Ruhian,https://www.themoviedb.org/t/p/w300_and_h450_bestv2/k4UvBLu3KekD1tws0gLbzzkqREw.jpg,1,"Yayan Ruhian was born in Tasikmalaya (West Java) on October 19, 1968. He found his passion in Pencak Silat and other martial arts, becoming a professional martial arts instructor. Ruhian is also known as an instructor of an inner breathing technique designed to condition of the body to withstand any impact. In 1988, he began teaching at Perguruan Silat Tenaga Dasar Indonesia (Inner Breathing Technique Silat School in Indonesia). During his term as an instructor he traveled regularly to teach in different cities and abroad.",1968-10-19,https://instagram.com/yayanruhian/,,2,2023-02-06 07:54:59.305471+00
151,Lance Reddick,https://www.themoviedb.org/t/p/w300_and_h450_bestv2/22mVtEXZbpt0J7S0LhIhdkfRrZV.jpg,1,"Lance Reddick (born December 31, 1962) is an American theater, film and TV actor and musician born in Baltimore, Maryland. He starred in The Wire as Cedric Daniels, appeared in Oz as Detective Johnny Basil and appeared in the fourth and fifth seasons of Lost.",1969-12-31,https://instagram.com/thereallancereddick/,https://twitter.com/lancereddick,1,2023-02-06 07:58:13.334839+00
152,Arifin Putra,https://www.themoviedb.org/t/p/w300_and_h450_bestv2/An0p5UDfq1Seeyg80E9lVFlfZmw.jpg,1,"Putra Arifin Scheunemann or better known as Arifin Putra (born in Jakarta, May 1, 1987) is an indonesian Actor.",1987-05-01,https://instagram.com/arifinputra_/,,2,2023-02-06 08:01:08.57799+00
153,Tio Pakusadewo,https://www.themoviedb.org/t/p/w300_and_h450_bestv2/uAbKPJPbXVg1pi1bAEEkaMxc0Br.jpg,1,"Kanjeng Raden Tumenggung Irwan Susetyo Pakusadewo, better known by the stage name Tio Pakusadewo (born 2 September 1963), is an Indonesian actor. He has won two Citra Awards for Best Leading Actor at the Indonesian Film Festival, for Lagu untuk Seruni (1990) and Identitas (2008).",1963-09-02,,,2,2023-02-06 08:01:29.535738+00
154,Oka Antara,https://www.themoviedb.org/t/p/w300_and_h450_bestv2/hxa27iexJSLga0x1NNxmpzQLh8V.jpg,1,"Oka Antara (native name: Nyoman Oka Antara, born: 8 July 1981) is an Indonesian rapper and actor of Balinese descent.",1981-07-08,,,2,2023-02-06 08:01:59.294439+00
155,Julie Estelle,https://www.themoviedb.org/t/p/w300_and_h450_bestv2/imnfhNrPN8etW6PzGxwpbSYyt3w.jpg,2,"Julie Estelle or her birth name Julie Estelle Gasnier (born January 4, 1989) is an Indonesian actress and model.Her first leading role in 2005 at the age of 15 was in the drama Alexandria, followed by the horror film Kuntilanak in 2006 (known as The Chanting in English), and two sequels in 2007 and 2008.",1989-01-04,https://instagram.com/julstelle/,https://twitter.com/Julstelle,2,2023-02-06 08:02:39.299646+00
156,Rio Dewanto,https://www.themoviedb.org/t/p/w300_and_h450_bestv2/mkukGDtAAsdMUxV8gJI6KW8tQnE.jpg,1,"Rio Dewanto (born in Indonesia, August 28, 1987) is an Indonesian actor and singer. His name is widely known through his roles in television films including Pulang Malu Ngga Pulang Rindu, Rocker Pulang Kampung, Cinta Datang saat kamu tidur. He has already played more than 30 FTV titles. Early in his career in feature films when appointed as extras in the film Ratu Cosmopolitan and the Forbidden Door. In 2011 Rio got the main role in a film done by Hanung Bramantyo entitled Question Mark. After that, he got a role as a homosexual in the film Arisan! 2 by Nia Dinata and was entrusted by Rudi Soedjarwo to portray the character of Pak Wisnu in the Garuda film in My Chest 2 as Coach.",1987-08-28,https://instagram.com/riodewanto/,,2,2023-02-06 08:08:42.04435+00
157,Chicco Jerikho,https://www.themoviedb.org/t/p/w300_and_h450_bestv2/7pRR3wHCKb5Dqj8enj8LygCI3pV.jpg,1,"Chicco Jerikho (born 3 July 1984) is an Indonesian actor, model and producer.",1984-06-03,https://www.instagram.com/chicco.jerikho,,2,2023-02-06 08:11:45.11764+00
158,Abimana Aryasatya,https://www.themoviedb.org/t/p/w300_and_h450_bestv2/st21RUdZjvr33tp2XDWzCwLaCzp.jpg,1,"Abimana Aryasatya is an Indonesian actor and film producer. He is best known for starring in the films Shackled (2012), The Night Comes For Us (2018), Gundala (2019), and in the highest-grossing Indonesian film of all time, Warkop DKI Reborn: Jangkrik Boss! Part 1 (2016). He has received multiple awards and nominations such as Indonesian Movie Awards, Indonesian Film Festival, and Indonesian Box Office Movie Awards",1982-10-24,https://instagram.com/abimana_arya/,,2,2023-02-06 08:12:53.888972+00
159,Tara Basro,https://www.themoviedb.org/t/p/w300_and_h450_bestv2/d9asO9KVxwNoT1Fhhvuo7GKimBJ.jpg,2,"Andi Mutiara Pertiwi Basro (born 11 June 1990), known as Tara Basro, is an Indonesian model and actress.

She made her debut in the Indonesian film industry by appearing as Putri in the latest sequel to the Si Boy Notes in 2011 entitled Si Boy's (Daily) Notes. The following year Tara appeared in a Hi5teria horror genre omnibus and a drama film Rumah dan Musim Hujan.",1990-06-11,https://instagram.com/tarabasro/,,2,2023-02-06 08:13:40.720747+00
160,Chelsea Islan,https://www.themoviedb.org/t/p/w300_and_h450_bestv2/hJHAGMO4v4dF28gJScbUCHmHLuh.jpg,2,"Chelsea Elizabeth Islan is an Indonesian actress. She made her film debut in the 2013 Indonesian drama film Refrain, she later continued her acting career in several films such as Street Society (2014), Merry Riana: Mimpi Sejuta Dolar (2014), Dibalik 98 (2015), and Guru Bangsa: Tjokroaminoto (2015). She also appears in the popular NET TV sitcom Tetangga Masa Gitu. She is fluent in Indonesian and English.",1995-06-02,https://instagram.com/chelseaislan/,https://twitter.com/chelseaislan,2,2023-02-06 08:14:39.378592+00
161,Luna Maya,https://www.themoviedb.org/t/p/w300_and_h450_bestv2/90vWCfUFACdqKEewpgQ7RQpLuA.jpg,2,"Luna Maya is an Indonesian soap opera actress, and movie star. She started her career as an advertising and catwalk model.",1983-08-26,https://www.instagram.com/lunamaya,,2,2023-02-06 08:19:39.299626+00
162,Ernest Prakasa,https://www.themoviedb.org/t/p/w300_and_h450_bestv2/sWFSf7mDxZ0crlmHToxmXRrWERr.jpg,1,"Ernest Prakasa is an Indonesian stand-up comedian, screenwriter, and film director.",1982-01-29,https://instagram.com/ernestprakasa/,https://twitter.com/ernestprakasa,2,2023-02-06 08:20:20.481522+00
163,Harrison Ford,https://www.themoviedb.org/t/p/w300_and_h450_bestv2/5M7oN3sznp99hWYQ9sX0xheswWX.jpg,1,"Legendary Hollywood Icon Harrison Ford was born on July 13, 1942 in Chicago, Illinois. His family history includes a strong lineage of actors, radio personalities, and models. Harrison attended public high school in Park Ridge, Illinois where he was a member of the school Radio Station WMTH. Harrison worked as the lead voice for sports reporting at WMTH for several years.",1942-07-13,,https://twitter.com/harrisonford_,1,2023-02-06 13:36:24.48588+00
164,Mark Hamill,https://www.themoviedb.org/t/p/w300_and_h450_bestv2/9Wws35pCsT0KoZpiV4Gk5nbn9ZD.jpg,1,"Mark Richard Hamill (born September 25, 1951) is an American actor, voice artist, producer, director, and writer. Hamill is best known for his role as Luke Skywalker in the original Star Wars trilogy and also well known for voice-acting characters such as the Joker in various animated series, animated films and video games, beginning with Batman: The Animated Series, the Skeleton king in Super Robot Monkey Team Hyperforce Go!, Fire Lord Ozai in Avatar: The Last Airbender, Master Eraqus in Kingdom Hearts: Birth by Sleep, Skips in Regular Show, and Senator Stampington on Metalocalypse.",1951-09-25,https://instagram.com/hamillhimself/,https://twitter.com/HamillHimself,1,2023-02-06 13:37:20.740969+00
165,Adam Driver,https://www.themoviedb.org/t/p/w300_and_h450_bestv2/muk9jCuNrXnPbDPTbAg5LRVCl2O.jpg,1,"Adam Douglas Driver (born November 19, 1983) is an American actor. He is the recipient of various accolades, including the Venice Film Festival Volpi Cup for Best Actor, in addition to nominations for a Tony Award, two Academy Awards, two British Academy Film Awards, two Golden Globe Awards, four Primetime Emmy Awards, and four Screen Actors Guild Awards. Martin Scorsese has called Driver ""one of the finest, if not the finest"" actors of his generation.",1983-11-19,,,1,2023-02-06 13:38:00.87399+00
166,Daisy Ridley,https://www.themoviedb.org/t/p/w300_and_h450_bestv2/kDTRF2bLgS48y5gcgZ66AHZFxSd.jpg,1,"Daisy Jazz Isobel Ridley (born 10 April 1992) is an English actress, who rose to prominence for her role as Rey in the Star Wars sequel trilogy: The Force Awakens (2015), The Last Jedi (2017), and The Rise of Skywalker (2019).

She also appeared in the mystery film Murder on the Orient Express (2017), played the title character of the romantic drama Ophelia (2018), and has done occasional voice acting, notably the live-action/animated film Peter Rabbit (2018) and video games such as 12 Minutes.",1992-04-10,https://instagram.com/daisyridley/,,1,2023-02-06 13:38:46.791176+00
167,Felicity Jones,https://www.themoviedb.org/t/p/w300_and_h450_bestv2/35KdWSfTldNEdsn4MUGFIRoxJEu.jpg,2,"Felicity Rose Hadley Jones (born 17 October 1983) is a British actress. She started her professional acting career as a child, appearing in The Treasure Seekers (1996) at age 12. She went on to play Ethel Hallow for one series of the television series The Worst Witch and its sequel Weirdsister College. On radio, she has played the role of Emma Grundy in the BBC's The Archers. In 2008, she appeared in the Donmar Warehouse production of The Chalk Garden.",1983-10-17,https://instagram.com/felicity.jones/,,3,2023-02-06 13:49:09.571559+00
168,Diego Luna,https://www.themoviedb.org/t/p/w300_and_h450_bestv2/uH8sMbiMmy9sprKr1vJpoPBB40E.jpg,1,"Diego Luna Alexander (Spanish pronunciation: [ˈdjeɣo ˈluna alekˈsandeɾ]; born 29 December 1979) is a Mexican actor, singer, director, and producer. Following a career in Mexican telenovelas, he has appeared in films including Y tu mamá también; Open Range; Milk; Rudo y Cursi; Dirty Dancing: Havana Nights; The Terminal; and Berlin, I Love You. He plays Cassian Andor in Rogue One: A Star Wars Story (2016) and Andor (2022-), and drug trafficker Miguel Ángel Félix Gallardo in the first two seasons of Narcos: Mexico.",1979-12-29,,https://twitter.com/diegoluna_,17,2023-02-06 13:49:47.896811+00
169,Donnie Yen,https://www.themoviedb.org/t/p/w300_and_h450_bestv2/hTlhrrZMj8hZVvD17j4KyAFWBHc.jpg,1,"Donnie Yen (Chinese: 甄子丹; born 27 July 1963) is a Hong Kong actor, martial artist, film director, action choreographer and film producer. Apart from being a well-known film and television actor in Hong Kong, Yen has also gained international recognition for appearing in many films together with other prominent and internationally-known actors such as Jackie Chan, Jet Li and Michelle Yeoh. He is considered to be Hong Kong's top action star; director Peter Chan mentioned that he ""is the 'it' action person right now"" and ""has built himself into a bona fide leading man, who happens to be an action star.""",1963-07-27,https://instagram.com/donnieyenofficial/,https://twitter.com/donnieyenct,9,2023-02-06 13:50:56.448789+00
170,Scott Adkins,https://www.themoviedb.org/t/p/w300_and_h450_bestv2/9NRr2a1riIn5CWn5McZLJlk4vxR.jpg,1,"An English actor and martial artist who is perhaps best known for playing Boyka in Undisputed II: Last Man Standing and Undisputed III: Redemption and Bradley Hume in Holby City and Ed Russell in Mile High. Adkins has also appeared in Dangerfield, Hollyoaks, The Tournament and many other TV series as well as many films.",1976-06-17,https://instagram.com/thescottadkins/,https://twitter.com/thescottadkins,3,2023-02-06 14:02:12.158146+00
171,Lynn Hung,https://www.themoviedb.org/t/p/w300_and_h450_bestv2/jSLg8PqxdwDWfCChU2RG0B6HmCX.jpg,2,"Lynn Hung (Chinese: 熊黛林, Mandarin Pinyin: Xióng Dàilín; Jyutping: Hung4 Doi6-lam4; born 10 October 1980), sometimes credited as her birth name Xiong Dailin, is a Chinese model and actress.",1981-10-10,,,9,2023-02-06 14:02:41.420344+00
172,Sammo Hung,https://www.themoviedb.org/t/p/w300_and_h450_bestv2/AsB9uRDQWdIbFGnkICEl8I2gDWn.jpg,1,"Sammo Hung (Chinese: 洪金寶, born Hung Kam Po, 7 January 1952) is a Hong Kong actor, martial artist, producer and director, known for his work in many kung fu films and Hong Kong action cinema. He has been a fight choreographer for, amongst others, Jackie Chan, King Hu, and John Woo. ",1952-01-07,,,6,2023-02-06 14:03:30.83538+00
173,Olga Kurylenko,https://www.themoviedb.org/t/p/w300_and_h450_bestv2/q0QXFRg5bSnaLjbvhamfclt0eId.jpg,2,"Olga Kurylenko was born on November 14, 1979, in Berdyansk, Ukraine, Soviet Union. She appeared opposite Elijah Wood in Paris, je t'aime (2006) and as Sofia in Le serpent (2006), then co-starred as Russian beauty Nika Boronina opposite Timothy Olyphant in Hitman (2007/I). She also appears as Mina Harud in the indy surveillance-thriller ""Tyranny"" (2008) and is billed as Camille, the Bond girl in Quantum of Solace (2008), a sequel to Casino Royale (2006).",1979-11-14,https://instagram.com/olgakurylenkoofficial/,https://twitter.com/OlyaKurylenko,31,2023-02-07 05:05:40.338023+00
174,Eva Green,https://www.themoviedb.org/t/p/w300_and_h450_bestv2/8MqXy7Jd6HsRSBFK05J0KrR2x5Z.jpg,2,"Eva Gaëlle Green, born July 6th 1980, is a French actress and model. She started her career in theatre before making her film debut in 2003 in Bernardo Bertolucci's controversial The Dreamers. She achieved international recognition when she appeared in Ridley Scott's Kingdom of Heaven, and portrayed Vesper Lynd in the James Bond film Casino Royale. In 2006, Green was awarded the BAFTA Rising Star Award.",1980-07-06,https://instagram.com/evagreenweb/,https://twitter.com/EvaGreenWeb,19,2023-02-07 05:11:04.397915+00
175,Aaron Eckhart,https://www.themoviedb.org/t/p/w300_and_h450_bestv2/5EFQvRHlpP1Iaw2e6vjOaBny6DV.jpg,1,"Aaron Edward Eckhart (born March 12, 1968) is an American actor. Born in Cupertino, California, Eckhart moved to the United Kingdom at early age, when his father relocated the family. Several years later, he began his acting career by performing in school plays, before moving to Australia for his high school senior year. He left high school without graduating, but earned a diploma through a professional education course, and graduated from Brigham Young University (BYU) in 1994 with a Bachelor of Fine Arts (BFA) degree in film.",1968-03-12,,,1,2023-02-07 05:54:53.860707+00
