id,name,image_url,gender,biography,birthday,instagram_url,twitter_url,country_id,created_at
1,Tom Cruise,https://www.themoviedb.org/t/p/w300_and_h450_bestv2/8qBylBsQf4llkGrWR3qAsOtOU8O.jpg,1,"Thomas Cruise Mapother IV (born July 3, 1962), known professionally as Tom Cruise, is an American actor and producer. One of the world's highest-paid actors, he has received various accolades, including an Honorary Palme d'Or and three Golden Globe Awards, in addition to nominations for three Academy Awards. His films have grossed over $4 billion in North America and over $11.1 billion worldwide, making him one of the highest-grossing box office stars of all time.",1962-07-03,https://instagram.com/tomcruise/,https://twitter.com/tomcruise,1,2023-01-31 08:34:44.320445+00
2,Henry Cavill,https://www.themoviedb.org/t/p/w300_and_h450_bestv2/dgTD7Q9owL3DyX9uYoSX9KZeUUz.jpg,1,"Henry William Dalgliesh Cavill (born 5 May 1983) is a British actor. He is known for his portrayal of Charles Brandon in Showtime's The Tudors (2007–2010), DC Comics character Superman in the DC Extended Universe, Geralt of Rivia in the Netflix fantasy series The Witcher (2019–present), as well as Sherlock Holmes in the Netflix film Enola Holmes (2020). Cavill began his career with roles in the feature adaptations of The Count of Monte Cristo (2002) and I Capture the Castle (2003). He later portrayed supporting roles in several television series, including BBC's The Inspector Lynley Mysteries, ITV's Midsomer Murders, and Showtime's The Tudors.",1983-03-03,https://instagram.com/henrycavill/,,3,2023-01-31 08:36:38.681533+00
3,Michelle Monaghan,https://www.themoviedb.org/t/p/w300_and_h450_bestv2/jB47BoGdudHELszn9ZAZqnnUy8N.jpg,2,"Michelle Lynn Monaghan is an American actress. Her first notable roles were in episodes of Young Americans, and Law & Order: Special Victims Unit, both in 2001. That year she also her big screen debut in the movie ""Perfume"" (2001), followed by another small role in ""Unfaithful"" (2002).

Monaghan had her big break in 2002 when she co-starred in the television series Boston Public.  She is known for her roles in feature films including Kiss Kiss Bang Bang, Gone Baby Gone, Made of Honor, The Heartbreak Kid, Eagle Eye and the Mission: Impossible franchise.",1976-03-23,https://instagram.com/michellemonaghan/,https://twitter.com/realmonaghan,1,2023-01-31 08:41:32.546027+00
4,Cobie Smulders,https://www.themoviedb.org/t/p/w300_and_h450_bestv2/gxuNyE9T8N0cESYiXMWiRiGH5ih.jpg,2,"Jacoba Francisca Maria ""Cobie"" Smulders (born April 3, 1982) is a Canadian-American actress. She is best known for her starring role as Robin Scherbatsky in the CBS sitcom How I Met Your Mother (2005–2014) and as S.H.I.E.L.D. agent Maria Hill in the Marvel Cinematic Universe superhero films The Avengers (2012), Captain America: The Winter Soldier (2014), Avengers: Age of Ultron (2015), Avengers: Infinity War (2018), Avengers: Endgame (2019), and Spider-Man: Far From Home (2019), as well as the ABC action drama series Agents of S.H.I.E.L.D (2013–2015), the Disney+ animated anthology series What If...? (2021), and the upcoming Disney+ limited series Secret Invasion (2022).",1982-04-03,https://instagram.com/cobiesmulders/,https://twitter.com/CobieSmulders,4,2023-01-31 13:51:55.746958+00
5,Robert Downey Jr.,https://www.themoviedb.org/t/p/w300_and_h450_bestv2/5qHNjhtjMD4YWH3UP0rm4tKwxCL.jpg,1,"Robert John Downey Jr. (born April 4, 1965) is an American actor and producer. His career has been characterized by critical and popular success in his youth, followed by a period of substance abuse and legal troubles, before a resurgence of commercial success later in his career. In 2008, Downey was named by Time magazine among the 100 most influential people in the world, and from 2013 to 2015, he was listed by Forbes as Hollywood's highest-paid actor.",1965-04-04,https://instagram.com/robertdowneyjr/,https://twitter.com/RobertDowneyJr,1,2023-01-31 13:55:24.942791+00
6,Chris Evans,https://www.themoviedb.org/t/p/w300_and_h450_bestv2/3bOGNsHlrswhyW79uvIHH1V43JI.jpg,1,"Christopher Robert Evans (born June 13, 1981) is an American actor. He gained wider recognition for his portrayal of Steve Rogers / Captain America in several Marvel Cinematic Universe films, namely Captain America: The First Avenger (2011), Captain America: The Winter Soldier (2014), and Captain America: Civil War (2016), and the ensemble films The Avengers (2012), Avengers: Age of Ultron (2015), Avengers: Infinity War (2018), and Avengers: Endgame (2019). His work on the Marvel series established him as one of the world's highest-paid actors.",1981-06-13,https://instagram.com/chrisevans/,https://twitter.com/ChrisEvans,1,2023-01-31 13:57:48.719283+00
7,Chris Hemsworth,https://www.themoviedb.org/t/p/w300_and_h450_bestv2/jpurJ9jAcLCYjgHHfYF32m3zJYm.jpg,1,"Chris Hemsworth (born 11 August 1983) is an Australian actor. He is best known for his roles as Kim Hyde in the Australian TV series Home and Away (2004) and as Thor in the Marvel Cinematic Universe films Thor (2011), The Avengers (2012), Thor: The Dark World (2013), Avengers: Age of Ultron (2015), Thor: Ragnarok (2017), Avengers: Infinity War (2018), Avengers: Endgame (2019), and Thor: Love and Thunder (2022). He has also appeared in the science fiction action film Star Trek(2009), the thriller adventure A Perfect Getaway (2009), the horror comedy The Cabin in the Woods (2012), the dark fantasy action film Snow White and the Huntsman (2012), the war film Red Dawn (2012) and the biographical sports drama film Rush (2013).",1983-08-11,https://instagram.com/chrishemsworth/,https://twitter.com/chrishemsworth,5,2023-01-31 13:59:28.276563+00
8,Scarlett Johansson,https://www.themoviedb.org/t/p/w300_and_h450_bestv2/6bBCPmc55gzP7TR9Th4WbykrYd0.jpg,2,"Scarlett Ingrid Johansson (born November 22, 1984) is an American actress. The world's highest-paid actress in 2018 and 2019, she has featured multiple times on the Forbes Celebrity 100 list. Her films have grossed over $14.3 billion worldwide, making Johansson the ninth-highest-grossing box office star of all time. She has received various accolades, including a Tony Award and a British Academy Film Award, in addition to nominations for two Academy Awards and five Golden Globe Awards.",1984-11-22,https://www.instagram.com/scarlettjohanssonworld/,,1,2023-01-31 14:01:45.327532+00
9,Jeremy Renner,https://www.themoviedb.org/t/p/w300_and_h450_bestv2/yB84D1neTYXfWBaV0QOE9RF2VCu.jpg,1,"Jeremy Lee Renner (born January 7, 1971) is an American actor. Renner played Clint Barton / Hawkeye in the Marvel Cinematic Universe films Thor (2011), The Avengers (2012), Avengers: Age of Ultron (2015), Captain America: Civil War (2016), Avengers: Endgame (2019), and Black Widow (2021) in an uncredited voice cameo; with a further appearance in the Disney+ show Hawkeye (2021). He also appeared in Mission: Impossible – Ghost Protocol (2011), The Bourne Legacy (2012), Hansel and Gretel: Witch Hunters (2013), American Hustle (2013), Mission: Impossible – Rogue Nation (2015), and Arrival (2016).",1971-01-07,https://instagram.com/jeremyrenner/,https://twitter.com/Renner4Real,1,2023-01-31 14:03:14.438829+00
10,Matt Damon,https://www.themoviedb.org/t/p/w300_and_h450_bestv2/At3JgvaNeEN4Z4ESKlhhes85Xo3.jpg,1,"Matthew Paige Damon (born October 8, 1970) is an American actor, film producer, and screenwriter. Ranked among Forbes' most bankable stars, the films in which he has appeared have collectively earned over $3.88 billion at the North American box office, making him one of the highest-grossing actors of all time. He is the recipient of various accolades, including an Academy Award from five nominations, and two Golden Globe Awards. He also received three BAFTA Award nominations, seven Primetime Emmy Award nominations, and six Screen Actors Guild Awards.",1970-10-08,https://www.instagram.com/mattdamonteam/,,1,2023-01-31 14:06:03.731825+00
11,Jason Statham,https://www.themoviedb.org/t/p/w300_and_h450_bestv2/lldeQ91GwIVff43JBrpdbAAeYWj.jpg,1,"Jason Statham (born 26 July 1967) is an English actor. He is known for portraying characters in various action-thriller films who are typically tough, hardboiled, gritty, or violent.

Statham began practising Chinese martial arts, kickboxing, and karate recreationally in his youth while working at local market stalls. An avid footballer and diver, he was a member of Britain's national diving team and competed for England in the 1990 Commonwealth Games. Shortly after, he was asked to model for French Connection, Tommy Hilfiger, and Levi's in various advertising campaigns. His past history working at market stalls inspired his casting in the Guy Ritchie crime films Lock, Stock and Two Smoking Barrels (1998) and Snatch (2000).",1967-07-26,https://instagram.com/jasonstatham/,,3,2023-02-01 22:49:30.029162+00
12,Tom Holland,https://www.themoviedb.org/t/p/w300_and_h450_bestv2/hMp5y4Nro5pv4Nawyt3Ld9TsKfO.jpg,1,"Thomas ""Tom"" Stanley Holland is an English actor and dancer.

He is best known for playing Peter Parker / Spider-Man in the Marvel Cinematic Universe and has appeared as the character in six films: Captain America: Civil War (2016), Spider-Man: Homecoming (2017), Avengers: Infinity War (2018), Avengers: Endgame (2019), Spider-Man: Far From Home (2019), and Spider-Man: No Way Home (2021).

He is also known for playing the title role in Billy Elliot the Musical at the Victoria Palace Theatre, London, as well as for starring in the 2012 film The Impossible.",1996-06-01,https://instagram.com/tomholland2013/,https://twitter.com/TomHolland1996,3,2023-02-01 22:50:44.33712+00
13,Chris Pratt,https://www.themoviedb.org/t/p/w300_and_h450_bestv2/83o3koL82jt30EJ0rz4Bnzrt2dd.jpg,1,"Christopher Michael Pratt (born 21 June 1979) is an American actor, known for starring in both television and action films. He rose to prominence for his television roles, particularly in the NBC sitcom Parks and Recreation (2009–2015), for which he received critical acclaim and was nominated for the Critics' Choice Television Award for Best Supporting Actor in a Comedy Series in 2013. He also starred earlier in his career as Bright Abbott in The WB drama series Everwood (2002–2006) and had roles in Wanted (2008), Jennifer's Body (2009), Moneyball (2011), The Five-Year Engagement (2012), Zero Dark Thirty (2013), Delivery Man (2013), and Her (2013).",1979-06-21,https://instagram.com/prattprattpratt/,https://twitter.com/prattprattpratt,1,2023-02-01 22:52:20.165796+00
14,Daniel Craig,https://www.themoviedb.org/t/p/w300_and_h450_bestv2/iFerDZUmC5Fu26i4qI8xnUVEHc7.jpg,1,"Daniel Wroughton Craig (born 2 March 1968) is a British actor. He gained international fame playing the secret agent James Bond in the eponymous film series, beginning with Casino Royale (2006) and in four further instalments, up to No Time to Die (2021).

After training at the National Youth Theatre in London and graduating from the Guildhall School of Music and Drama in 1991, Craig began his career on stage. He made his film debut in the drama The Power of One (1992) and the family film A Kid in King Arthur's Court (1995), with his breakthrough role coming in the drama serial Our Friends in the North (1996). He gained roles in the period film Elizabeth (1998), the action film Lara Croft: Tomb Raider (2001), before appearing in the crime thrillers Road to Perdition (2002), Layer Cake (2004), as well as the historical drama film Munich (2005).",1968-03-02,,,3,2023-02-01 22:53:14.903601+00
15,Brad Pitt,https://www.themoviedb.org/t/p/w300_and_h450_bestv2/oTB9vGIBacH5aQNS0pUM74QSWuf.jpg,1,"William Bradley Pitt (born December 18, 1963) is an American actor and film producer. He is the recipient of various accolades, including an Academy Award, a British Academy Film Award, and two Golden Globe Awards for his acting, in addition to a second Academy Award, a second British Academy Film Award, a third Golden Globe Award, and a Primetime Emmy Award as a producer under his production company, Plan B Entertainment.

Pitt first gained recognition as a cowboy hitchhiker in the road film Thelma & Louise (1991). His first leading roles in big-budget productions came with the drama films A River Runs Through It (1992) and Legends of the Fall (1994), and the horror film Interview with the Vampire (1994). He gave critically acclaimed performances in the crime thriller Seven (1995) and the science fiction film 12 Monkeys (1995), the latter earning him a Golden Globe Award for Best Supporting Actor and an Academy Award nomination.",1963-12-18,,,1,2023-02-01 22:54:16.449839+00
16,Paul Rudd,https://www.themoviedb.org/t/p/w300_and_h450_bestv2/8eTtJ7XVXY0BnEeUaSiTAraTIXd.jpg,1,"Paul Stephen Rudd (born April 6, 1969) is an American actor, comedian, screenwriter and producer. He studied theater at the University of Kansas and the American Academy of Dramatic Arts before making his acting debut in 1991.

Rudd's films include Clueless (1995), Halloween: The Curse of Michael Myers (1995), Romeo + Juliet (1996), The Object of My Affection (1998), Wet Hot American Summer (2001), Anchorman: The Legend of Ron Burgundy (2004), The 40-Year-Old Virgin (2005), Knocked Up (2007), This Is 40 (2012), Wanderlust (2012), Mute (2018), The Fundamentals of Caring (2016), Ideal Home (2018), and Ghostbusters: Afterlife (2021). He also has played Ant-Man in the Marvel Cinematic Universe, appearing in Ant-Man (2015), Captain America: Civil War (2016), Ant-Man and the Wasp (2018), Avengers: Endgame (2019), and the animated series What If…? (2021).",1969-04-06,,,1,2023-02-01 23:01:13.399314+00
17,Natalie Portman,https://www.themoviedb.org/t/p/w300_and_h450_bestv2/zE90yInhhU8fLz1HgWpB9KPvGnE.jpg,2,"Natalie Portman (born Neta-Lee Hershlag, June 9, 1981) is an actress with dual American and Israeli citizenship. Her first role was in the 1994 action thriller Léon: The Professional, opposite Jean Reno. She was later cast as Padmé Amidala in the Star Wars prequel trilogy (released in 1999, 2002 and 2005).

Born in Jerusalem to an Israeli father and American mother, Portman grew up in the eastern United States from the age of three. She studied dancing and acting in New York, and starred in Star Wars: Episode I – The Phantom Menace while still at high school on Long Island. In 1999, Portman enrolled at Harvard University to study psychology, alongside her work as an actress; she completed a bachelor's degree in 2003. During her studies she starred in a second Star Wars film and opened in New York City's The Public Theater production of Anton Chekhov's The Seagull in 2001.",1981-06-09,https://instagram.com/natalieportman/,,1,2023-02-01 23:02:28.255683+00
18,Jackie Chan,https://www.themoviedb.org/t/p/w300_and_h450_bestv2/nraZoTzwJQPHspAVsKfgl3RXKKa.jpg,1,"Jackie Chan (Chinese: 成龍; born 7 April 1954), born Chan Kong-sang, is a Hong Kong actor, action choreographer, filmmaker, comedian, producer, martial artist, screenwriter, entrepreneur, singer and stunt performer. In his movies, he is known for his acrobatic fighting style, comic timing, use of improvised weapons, and innovative stunts. Jackie Chan has been acting since the 1970s and has appeared in over 100 films.

Chan has received stars on the Hong Kong Avenue of Stars and the Hollywood Walk of Fame. As a cultural icon, Chan has been referenced in various pop songs, cartoons, and video games. Chan is also a Cantopop and Mandopop star, having released a number of albums and sung many of the theme songs for the films in which he has starred.",1954-04-07,https://instagram.com/jackiechan/,https://twitter.com/EyeOfJackieChan,6,2023-02-01 23:04:06.625829+00
19,Ryan Reynolds,https://www.themoviedb.org/t/p/w300_and_h450_bestv2/52GxBTYdLLc3x3UVSplZdHqj4RR.jpg,1,"Ryan Rodney Reynolds (born October 23, 1976) is a Canadian actor and film producer. He began his career starring in the Canadian teen soap opera Hillside (1991–1993), and had minor roles before landing the lead role on the sitcom Two Guys and a Girl between 1998 and 2001. Reynolds then starred in a range of films, including comedies such as National Lampoon's Van Wilder (2002), Waiting... (2005), and The Proposal (2009). He also performed in dramatic roles in Buried (2010), Woman in Gold (2015), and Life (2017), starred in action films such as Blade: Trinity (2004), Green Lantern (2011), 6 Underground (2019) and Free Guy (2021), and provided voice acting in the animated features The Croods (2013), Turbo (2013), Pokémon: Detective Pikachu (2019) and The Croods: A New Age (2020).",1976-10-23,https://instagram.com/vancityreynolds/,https://twitter.com/VancityReynolds,4,2023-02-01 23:05:20.24941+00
20,Keanu Reeves,https://www.themoviedb.org/t/p/w300_and_h450_bestv2/4D0PpNI0kmP58hgrwGC3wCjxhnm.jpg,1,"Keanu Charles Reeves is a Canadian actor. Reeves is known for his roles in Bill & Ted's Excellent Adventure, Speed, Point Break, and The Matrix franchise as Neo. He has collaborated with major directors such as Stephen Frears (in the 1988 period drama Dangerous Liaisons); Gus Van Sant (in the 1991 independent film My Own Private Idaho); and Bernardo Bertolucci (in the 1993 film Little Buddha). Referring to his 1991 film releases, The New York Times' critic, Janet Maslin, praised Reeves' versatility, saying that he ""displays considerable discipline and range. He moves easily between the buttoned-down demeanor that suits a police procedural story and the loose-jointed manner of his comic roles."" A repeated theme in roles he has portrayed is that of saving the world, including the characters of Ted Logan, Buddha, Neo, Johnny Mnemonic, John Constantine and Klaatu.",1964-08-02,,,4,2023-02-01 23:08:03.137477+00
21,Vin Diesel,https://www.themoviedb.org/t/p/w300_and_h450_bestv2/7rwSXluNWZAluYMOEWBxkPmckES.jpg,1,"Mark Sinclair (born 18 July 1967), known professionally as Vin Diesel, is an American actor, producer, director and screenwriter. He is best known for playing Dominic Toretto in the Fast & Furious franchise and is one of the highest-grossing actors of all time.

He began his career in 1990 but struggled to gain roles until he wrote, directed, produced, scored, and starred in the short film Multi-Facial (1995). This attracted the attention of Steven Spielberg, who was developing Saving Private Ryan (1998); Spielberg re-wrote elements of the film to allow Diesel to appear. He subsequently voiced the titular character in The Iron Giant (1999) while gaining a reputation as an action star after headlining the Fast & Furious, XXX, and The Chronicles of Riddick film franchises.",1967-07-18,https://instagram.com/vindiesel/,https://twitter.com/vindiesel,1,2023-02-01 23:09:00.127257+00
22,Benedict Cumberbatch,https://www.themoviedb.org/t/p/w300_and_h450_bestv2/fBEucxECxGLKVHBznO0qHtCGiMO.jpg,1,"Benedict Timothy Carlton Cumberbatch (born 19 July 1976) is an English actor. Known for his roles on the screen and stage, he has received various accolades throughout his career, including a Primetime Emmy Award, a British Academy Television Award, and a Laurence Olivier Award. Cumberbatch won the Laurence Olivier Award for Best Actor in a Leading Role in a Play for Frankenstein and a Primetime Emmy Award for Outstanding Lead Actor in a Miniseries or Movie for Sherlock. His performances in the dramas The Imitation Game (2014) and The Power of the Dog (2021) earned him nominations for an Academy Award, a BAFTA Award, a Screen Actors Guild Award, and a Golden Globe Award, all for Best Actor in a Leading Role. For playing the title role in five-part drama miniseries Patrick Melrose, he won a BAFTA TV Award for Best Actor in a Leading Role.",1976-07-19,,,3,2023-02-01 23:11:15.569904+00
23,Leonardo DiCaprio,https://www.themoviedb.org/t/p/w300_and_h450_bestv2/wo2hJpn04vbtmh0B9utCFdsQhxM.jpg,1,"Leonardo Wilhelm DiCaprio (born November 11, 1974) is an American actor and film producer. Known for his work in biopics and period films, DiCaprio is the recipient of numerous accolades, including an Academy Award, a British Academy Film Award, and three Golden Globe Awards. As of 2019, his films have grossed over $7.2 billion worldwide, and he has been placed eight times in annual rankings of the world's highest-paid actors.

Born in Los Angeles, DiCaprio began his career in the late 1980s by appearing in television commercials. In the early 1990s, he had recurring roles in various television shows, such as the sitcom Parenthood, and had his first major film part as author Tobias Wolff in This Boy's Life (1993). At age 19, he received critical acclaim and his first Academy Award and Golden Globe Award nominations for his performance as a developmentally disabled boy in What's Eating Gilbert Grape (1993). He achieved international stardom with the star-crossed romances Romeo + Juliet (1996) and Titanic (1997).

After the latter became the highest-grossing film at the time, he reduced his workload for a few years. In an attempt to shed his image of a romantic hero, DiCaprio sought roles in other genres, including crime drama in Catch Me If You Can (2002) and Gangs of New York (2002); the latter marked the first of his many successful collaborations with director Martin Scorsese. DiCaprio portrayed Howard Hughes in The Aviator (2004) and received acclaim for his performances in the political thriller Blood Diamond (2006), the crime drama The Departed (2006), and the romantic drama Revolutionary Road (2008).

In the following decade, DiCaprio starred in several high-profile directors' projects, including the science fiction thriller Inception (2010), the western Django Unchained (2012), the biopic The Wolf of Wall Street (2013), the survival drama The Revenant (2015), for which he won an Academy Award and a BAFTA Award for Best Actor in a Leading Role, and the comedy-drama Once Upon a Time in Hollywood (2019), all of which were critical and commercial successes.

DiCaprio is the founder of Appian Way Productions, a production company that has produced some of his films and the documentary series Greensburg (2008–2010), and the Leonardo DiCaprio Foundation, a nonprofit organization devoted to promoting environmental awareness. He regularly supports charitable causes and has produced several documentaries on the environment. In 2005, he was named a Commander of the Ordre des Arts et des Lettres for his contributions to the arts, and in 2016, he appeared in Time magazine's 100 most influential people in the world.",1974-11-11,https://instagram.com/leonardodicaprio/,https://twitter.com/leodicaprio,1,2023-02-01 23:12:29.621783+00
24,Jason Momoa,https://www.themoviedb.org/t/p/w300_and_h450_bestv2/6dEFBpZH8C8OijsynkSajQT99Pb.jpg,1,"Joseph Jason Namakaeha Momoa (born August 1, 1979) is an American actor and filmmaker. He made his acting debut as Jason Ioane on the syndicated action drama series Baywatch: Hawaii (1999–2001), which was followed by his portrayal of Ronon Dex on the Syfy science fiction series Stargate Atlantis (2005–2009), Khal Drogo in the first two seasons of the HBO fantasy drama series Game of Thrones (2011–2012), Declan Harp on the Discovery Channel historical drama series Frontier (2016–2018), and Baba Voss on the Apple TV+ science fiction series See (2019–present). Momoa was featured as the lead of the two lattermost series.

Since 2016, Momoa portrays Arthur Curry / Aquaman in the DC Extended Universe (DCEU), headlining the eponymous 2018 film and its 2023 sequel. Momoa also played Duncan Idaho in the 2021 film adaptation of the science fiction novel Dune.",1979-08-01,https://instagram.com/prideofgypsies/,,1,2023-02-01 23:15:00.386758+00
25,Chris Pine,https://www.themoviedb.org/t/p/w300_and_h450_bestv2/7mHvPL2TsfMBEeEmO0Iww8hpQXZ.jpg,1,"Chris Pine (born August 26, 1980) is an American actor. Pine made his feature film debut as Lord Devereaux in The Princess Diaries 2: Royal Engagement (2004). He is best known for his roles as James T. Kirk in the Star Trek reboot film series (2009–2016), Will Colson in Unstoppable (2010), Cinderella's Prince in Into the Woods (2014), Jack Ryan in Jack Ryan: Shadow Recruit (2014), Toby Howard in Hell or High Water (2016), Bernie Webber in The Finest Hours (2016), Steve Trevor in Wonder Woman (2017) and Wonder Woman 1984 (2020), Dr. Alexander Murry in A Wrinkle in Time (2018), and Robert the Bruce in Outlaw King (2018). Pine also voiced Jack Frost in Rise of the Guardians (2012).",1980-08-26,,,1,2023-02-01 23:15:47.528438+00
26,Hailee Steinfeld,https://www.themoviedb.org/t/p/w300_and_h450_bestv2/q4UpZMEuvNCN5lL5L6xa3ICpheJ.jpg,2,"Hailee Steinfeld (born December 11, 1996) is an American actress and singer. Known for her acting versatility and musical prowess, she is the recipient of various accolades, including a Peabody Award, a Critics' Choice Movie Award, a Billboard Music Award, and nominations for an Academy Award, a British Academy Film Award, a Golden Globe Award, three Critics' Choice Movie Awards and a Screen Actors Guild Award.

She had her breakthrough with the western drama film True Grit (2010), which earned her Academy Award and Screen Actors Guild Award nominations for Best Supporting Actress, and a BAFTA Award nomination for Best Actress. Steinfeld then rose to mainstream prominence for her lead roles in Ender's Game (2013), Romeo & Juliet (2013), Begin Again (2013), and 3 Days to Kill (2014).",1996-12-11,https://instagram.com/haileesteinfeld/,https://twitter.com/HaileeSteinfeld,1,2023-02-01 23:17:10.689741+00
