id,name,image_url,gender,biography,birthday,instagram_url,twitter_url,country_id,created_at
51,Dwayne Johnson,https://www.themoviedb.org/t/p/w300_and_h450_bestv2/cgoy7t5Ve075naBPcewZrc08qGw.jpg,1,"An American and Canadian actor, producer and semi-retired professional wrestler, signed with WWE. Johnson is half-Black and half-Samoan. His father, Rocky Johnson, is a Black Canadian, from Nova Scotia, and part of the first Black tag team champions in WWE history back when it was known as the WWF along with Tony Atlas. His mother is Samoan and the daughter of Peter Maivia, who was also a pro wrestler. Maivia's wife, Lia Maivia, was one of wrestling's few female promoters, taking over Polynesian Pacific Pro Wrestling after her husband's death in 1982, until 1988. Through his mother, he is considered a non-blood relative of the Anoa'i wrestling family. On March 29, 2008, The Rock inducted his father and his grandfather into the WWE Hall of Fame.

As of 2014, Johnson has a home in Southwest Ranches, Florida as well as Los Angeles, California. He also owns a farm in Virginia. In 2009, Johnson gained citizenship in Canada in honor of his father's background. Though Johnson was previously registered as a Republican, he voted for Barack Obama in the 2008 and 2012 United States presidential elections and is now an independent voter. He stated he did not vote in the 2016 U.S. election.",1972-05-02,https://instagram.com/therock/,https://twitter.com/therock,1,2023-02-02 00:00:34.687599+00
52,Shia LaBeouf,https://www.themoviedb.org/t/p/w300_and_h450_bestv2/frYAEeYMi9jdt9MIjGA8vCr5yUC.jpg,1,"Shia Saide LaBeouf (born June 11, 1986) is an American actor, performance artist, and filmmaker. He played Louis Stevens in the Disney Channel series Even Stevens, a role for which he received Young Artist Award nominations in 2001 and 2002 and won a Daytime Emmy Award in 2003. He made his film debut in The Christmas Path (1998). In 2004, he made his directorial debut with the short film Let's Love Hate and later directed a short film titled Maniac (2011), starring American rappers Cage and Kid Cudi.

In 2007, LaBeouf starred in the commercially successful films Disturbia and Surf's Up. The same year he was cast in Michael Bay's science fiction film Transformers as Sam Witwicky, the main protagonist of the series. Transformers was a box office success and one of the highest-grossing films of 2007. LaBeouf later appeared in its sequels Transformers: Revenge of the Fallen (2009) and Transformers: Dark of the Moon (2011), both also box office successes. In 2008, he played Henry ""Mutt Williams"" Jones III in Indiana Jones and the Kingdom of the Crystal Skull.",1986-06-11,https://instagram.com/labeoufronkkoturner/,https://twitter.com/thecampaignbook,1,2023-02-02 00:23:46.770579+00
53,Martin Lawrence,https://www.themoviedb.org/t/p/w300_and_h450_bestv2/15Ck85zfgWkmSMfNYLkE9JLTP7s.jpg,1,"Martin Fitzgerald Lawrence (born April 16, 1965) is an American actor, film director, film producer, screenwriter, and comedian who was born in Frankfurt am Main, Germany. He came to fame during the 1990s, establishing a Hollywood career as a leading actor, most notably the films Bad Boys, Blue Streak, Big Momma's House and Bad Boys II. Lawrence has acted in numerous movie roles and starred in his own television series, Martin, which ran from 1992 to 1997.",1965-04-16,https://instagram.com/martinlawrence/,https://twitter.com/realmartymar,8,2023-02-02 06:33:43.882871+00
54,Rami Malek,https://www.themoviedb.org/t/p/w300_and_h450_bestv2/mESIaMPIPxtyWDQ6DAChUBobOp5.jpg,1,"Rami Said Malek (born May 12, 1981) is an American actor from Los Angeles. He won a Critics' Choice Award and the Primetime Emmy Award for Outstanding Lead Actor in a Drama Series for his lead role as Elliot Alderson in the USA Network television series Mr. Robot. He also received Golden Globe Award, Screen Actors Guild Award, and TCA Award nominations. Furthermore, he’s won an Academy Award and a Golden Globe for portraying Freddie Mercury in the biopic Bohemian Rhapsody.

Malek has acted in supporting roles for other film and television series such as Night at the Museum trilogy, Fox comedy series The War at Home (2005–2007), HBO miniseries The Pacific (2010), Larry Crowne (2011), Paul Thomas Anderson's The Master (2012), The Twilight Saga: Breaking Dawn – Part 2 (2012), the independent film Ain't Them Bodies Saints (2013) and the dramatic film Short Term 12 (2013). He was also in the videogame Until Dawn (2015) as Joshua ""Josh"" Washington.",1981-05-12,https://instagram.com/ramimalek/,https://twitter.com/ItsRamiMalek,1,2023-02-02 06:34:55.627962+00
55,Angelina Jolie,https://www.themoviedb.org/t/p/w300_and_h450_bestv2/k3W1XXddDOH2zibPkNotIh5amHo.jpg,2,"Angelina Jolie is an American actress. She has received an Academy Award, two Screen Actors Guild Awards, and three Golden Globe Awards. Jolie has promoted humanitarian causes throughout the world, and is noted for her work with refugees as a Goodwill Ambassador for the United Nations High Commissioner for Refugees (UNHCR). She has been cited as one of the world's most beautiful women and her off-screen life is widely reported.

Though she made her screen debut as a child alongside her father Jon Voight in the 1982 film Lookin' to Get Out, Jolie's acting career began in earnest a decade later with the low-budget production Cyborg 2 (1993). Her first leading role in a major film was in Hackers (1995). She starred in the critically acclaimed biographical films George Wallace (1997) and Gia (1998), and won an Academy Award for Best Supporting Actress for her performance in the drama Girl, Interrupted (1999). Jolie achieved wider fame after her portrayal of video game heroine Lara Croft in Lara Croft: Tomb Raider (2001), and since then has established herself as one of the best-known and highest-paid actresses in Hollywood. She has had her biggest commercial successes with the action-comedy Mr. & Mrs. Smith (2005) and the animated film Kung Fu Panda (2008).",1975-06-04,https://instagram.com/angelinajolie/,,1,2023-02-02 06:36:18.00486+00
56,John Leguizamo,https://www.themoviedb.org/t/p/w300_and_h450_bestv2/kEbXDtcPJ46GEhj5QlCTLZS6PWE.jpg,1,"John Alberto Leguizamo Peláez (born July 22, 1960) is an American actor, comedian, and film producer. He has appeared in over 100 films, produced over 20 films and documentaries, made over 30 television appearances, and has produced various television projects. He's also written and performed for the Broadway stage receiving three Tony Award nominations for Freak in 1998, Sexaholix in 2002, and Latin History for Morons in 2018. He received a Special Tony Award in 2018.

He rose to fame with a co-starring role in Super Mario Bros. (1993) as Luigi, Benny Blanco in the crime drama Carlito's Way (1993), and later To Wong Foo, Thanks for Everything! Julie Newmar (1995), for which he received a Golden Globe Award for Best Supporting Actor nomination. Other films include Romeo + Juliet (1996), A Brother's Kiss (1997), Summer of Sam (1999), Moulin Rouge! (2001), The Alibi (2006), Righteous Kill (2008), Repo Men (2010), The Counselor (2013), John Wick (2014), and The Menu (2022). He served as the narrator of the sitcom The Brothers García (2000–2004) and voiced Sid the Sloth in the Ice Age franchise (2002–2016), and as Bruno in Encanto (2021).",1964-07-22,https://instagram.com/johnleguizamo/,https://twitter.com/JohnLeguizamo,11,2023-02-02 06:37:49.665623+00
57,Johnny Depp,https://www.themoviedb.org/t/p/w300_and_h450_bestv2/dHvp2FafEE5OGFy9kcX2l8oMIsH.jpg,1,"John Christopher Depp II (born June 9, 1963) is an American actor, producer, and musician. He is the recipient of various accolades, including a Golden Globe Award and a Screen Actors Guild Award, in addition to nominations for three Academy Awards and two British Academy Film Awards.

Depp made his debut in the horror film A Nightmare on Elm Street (1984), before rising to prominence as a teen idol on the television series 21 Jump Street (1987–1990). In the 1990s, Depp acted mostly in independent films, often playing eccentric characters. These included What's Eating Gilbert Grape (1993), Benny and Joon (1993), Dead Man (1995), Donnie Brasco (1997) and Fear and Loathing in Las Vegas (1998). Depp also began collaborating with director Tim Burton, starring in Edward Scissorhands (1990), Ed Wood (1994) and Sleepy Hollow (1999).",1963-06-09,https://instagram.com/johnnydepp/,,1,2023-02-02 06:38:48.860336+00
58,Monica Barbaro,https://www.themoviedb.org/t/p/w300_and_h450_bestv2/hiOYXzSkkuKyCEcjLxBoAc4bLZS.jpg,2,"Barbaro began her career as a ballet dancer, ultimately giving it up to pursue acting. She portrayed the character of Yael on the second season of the Lifetime television series UnREAL. Yael was also known as ""Hot Rachel,"" a nemesis to the character portrayed by Shiri Appleby. Following her work on UnREAL, Barbaro joined the cast as a lead of the new NBC legal drama Chicago Justice, an entry in Dick Wolf's Chicago franchise, where she portrayed Anna Valdez, a well-educated, whip-smart, quick-tongued and sharp-witted Assistant State’s Attorney. Barbaro plays the recurring role of Lisa Apple, Martin's new girlfriend, in the ABC sitcom Splitting Up Together. She had her first lead role in the viral short film It's not about the Nail.",1990-06-17,https://instagram.com/monicabarbaro/,,1,2023-02-02 06:40:43.885478+00
59,Steven Seagal,https://www.themoviedb.org/t/p/w300_and_h450_bestv2/fGNIEpn3JqOckY3ahnJX9x3qA94.jpg,1,"Steven Seagal is an American action film star, producer, writer, martial artist, guitarist and a reserve deputy sheriff. A 7th-dan black belt in Aikido, Seagal began his adult life as an Aikido instructor in Japan. He became the first foreigner to operate an Aikido Dojo in Japan. He later moved to the Los Angeles, California, area where he made his film debut in 1988 in Above the Law. By 1991, he had starred in three successful films, and would go on to achieve greater fame in Under Siege (1992), where he played Navy SEALs counter-terrorist expert Casey Ryback. However, his image became tarnished when both On Deadly Ground (1994, which he directed) and Under Siege 2: Dark Territory (1995) did poorly in theaters. During the later half of the 90s, he starred in three more theatrical films and a direct-to-video The Patriot. Aside from Exit Wounds (2001) and Half Past Dead (2002), his career shifted almost entirely to direct-to-video films (often low budget productions and shot in Europe or Asia). Between 1998 to 2009, he appeared in a total of 22 of these. At the age of 59, he finally returned to the big screen as Torrez in the 2010 film Machete. As of 2011, he's currently busy with the third season of his reality show Steven Seagal: Lawman. Seagal is also a recording artist and guitarist and the founder of Steven Seagal Enterprises. In addition to his professional achievements, he is also known as an environmentalist, an animal rights activist and a supporter of the 14th Dalai Lama Tenzin Gyatso, and the Tibetan independence movement.",1952-04-10,https://instagram.com/seagalofficial/,https://twitter.com/sseagalofficial,1,2023-02-02 06:49:23.468486+00
60,Paul Walker,https://www.themoviedb.org/t/p/w300_and_h450_bestv2/q2PLqKHYCs35HR7QybaNPH3JT96.jpg,1,"Paul William Walker IV (September 12, 1973 – November 30, 2013) was an American actor. He became well known in 1999 after his role in the hit film Varsity Blues. However, he was perhaps best known for starring as Brian O'Conner in The Fast and the Furious film series. His other films include Eight Below, Into the Blue, She's All That and Takers.",1973-09-12,https://instagram.com/paulwalker/,https://twitter.com/RealPaulWalker,1,2023-02-02 06:54:04.192197+00
61,Laura Haddock,https://www.themoviedb.org/t/p/w300_and_h450_bestv2/6kRUvA7N3pMzznG9PdiqCOvxhGQ.jpg,2,"Born in Enfield, London and raised in Harpenden, Hertfordshire (where she attended St. George's School), Haddock left school at the age of 17 and moved to London to study drama. She trained at Arts Educational School in Chiswick. Haddock made her television debut in the television pilot Plus One, part of the Comedy Showcase 2008. Her other television credits include The Palace, My Family, The Colour of Magic, Marple: A Pocket Full of Rye and Honest, playing the lead role of Kacie Carter. She also appeared in the pilot episode of Life Is Wild, the American version of Wild at Heart. She also starred in adverts for dot tel. Haddock played the lead role of Natasha in the ITV1 comedy dramaMonday Monday, and appears in series two and three of How Not to Live Your Life, replacing previous female leadSinéad Moynihan. In 2011, she appeared in the Cinemax/Sky TV drama Strike Back: Project Dawn for two episodes playing the kidnapped daughter of an illegal arms dealer. She stars as Lucrezia Donati, the mistress of Lorenzo de' Medici and lover ofLeonardo da Vinci in the 2013 series Da Vinci's Demons. Haddock's theatre credits include Famous Last, which formed as part of the 2009 Sky Arts Theatre Live! project, and Rutherford & Son at Northern Stage.",1985-08-21,https://instagram.com/laurajhaddock/,https://twitter.com/laurajhaddock,3,2023-02-02 06:55:13.325577+00
62,John Cena,https://www.themoviedb.org/t/p/w300_and_h450_bestv2/rgB2eIOt7WyQjdgJCOuESdDlrjg.jpg,1,"John Felix Anthony Cena is an American professional wrestler, actor, and former rapper currently signed to WWE. Widely regarded as one of the greatest professional wrestlers of all time, he is tied with Ric Flair for the most world championship reigns in professional wrestling history.

Born and raised in West Newbury, Massachusetts, Cena moved to California in 1998 to pursue a career as a bodybuilder. He transitioned to professional wrestling in 1999 when he debuted for Ultimate Pro Wrestling (UPW). He signed with the World Wrestling Federation (WWF, now WWE) in 2001, where he was initially assigned to Ohio Valley Wrestling (OVW). He gained fame in the WWE after adopting the persona of a trash-talking rapper. He won his first singles title, the United States Championship, in 2004. The next year, he won the WWE Championship for the first time, and his character subsequently transitioned into a clean-cut ""Superman-like"" hero. He then led the company as its franchise player, and public face for the next decade.",1977-04-23,https://instagram.com/johncena/,https://twitter.com/JohnCena,1,2023-02-02 06:58:15.387806+00
63,Rowan Atkinson,https://www.themoviedb.org/t/p/w300_and_h450_bestv2/uxqBoDQoDJ8cdkeB1hT56QkA3b5.jpg,1,"Rowan Sebastian Atkinson CBE, is an English comedian, screenwriter, and actor. He is most famous for his work on the satirical sketch comedy show Not The Nine O'Clock News, and the sitcoms Blackadder, Mr. Bean, and The Thin Blue Line. He has been listed in The Observer as one of the 50 funniest actors in British comedy, and amongst the top 50 comedy actors ever in a 2005 poll of fellow comedians.

Atkinson was born in Consett, County Durham, England. The youngest of four brothers, his parents were Eric Atkinson, a farmer and company director, and Ella May (née Bainbridge), who married on 29 June 1945. His three older brothers are Paul, who died as an infant; Rodney, a Eurosceptic economist who narrowly lost the UK Independence Party leadership election in 2000 and Rupert.",1955-01-06,,,3,2023-02-02 06:59:01.851346+00
64,Sebastian Stan,https://www.themoviedb.org/t/p/w300_and_h450_bestv2/nKZgixTbHFXpkzzIpMFdLX98GYh.jpg,1,"Sebastian Stan (born August 13, 1982) is a Romanian and American actor. He gained recognition for his role as Bucky Barnes / Winter Soldier in the Marvel Cinematic Universe media franchise, beginning with 2011's Captain America: The First Avenger. He later returned in Captain America: The Winter Soldier (2014), and went on to star in Captain America: Civil War (2016), Avengers: Infinity War (2018), Avengers: Endgame (2019) and The Falcon and the Winter Soldier (2021).

On television, he has played Carter Baizen in Gossip Girl, Prince Jack Benjamin in Kings, Jefferson in Once Upon a Time, and T.J. Hammond in Political Animals. The latter earned him a nomination for the Critics' Choice Television Award for Best Supporting Actor in a Movie/Miniseries. In films, he co-starred in Jonathan Demme's comedy-drama Ricki and the Flash and Ridley Scott's science fiction film The Martian. In 2017, he portrayed Jeff Gillooly in the biopic I, Tonya, and in 2022, he stars in the miniseries Pam & Tommy.",1982-08-13,https://instagram.com/imsebastianstan/,,12,2023-02-02 07:11:40.118519+00
65,Daniel Brühl,https://www.themoviedb.org/t/p/w300_and_h450_bestv2/3YlmTfiy5qZXkrdKGjaM1uMjGKP.jpg,1,"Daniel César Martín Brühl González Domingo (born 16 June 1978) is a German actor, producer and director. He is best known for Good Bye Lenin! (2003), Inglourious Basterds (2009), Rush (2013) and Captain America: Civil War (2016). Daniel speaks German, Spanish, English, French, Portuguese and Català.",1978-06-16,https://instagram.com/thedanielbruhl/,,13,2023-02-02 07:17:24.079817+00
66,Adam Baldwin,https://www.themoviedb.org/t/p/w300_and_h450_bestv2/w5f3i7H8wMzHvzYfezIVN521N7Q.jpg,1,"Appearing in dozens of films since 1980, Baldwin rose to prominence as the troubled outcast Ricky Linderman in My Bodyguard (1980) and moved on to bigger roles in D.C. Cab (1983), Full Metal Jacket (1987), Independence Day (1996), The Patriot (2000) and Serenity (2005)—in which he reprises his role as the mercenary Jayne Cobb from the television series Firefly. His other work includes Radio Flyer (1992), From the Earth to the Moon (1998), The X-Files (Knowle Rohrer), Smoke Jumpers (1996), The Cape, Men in Black: The Series, Stargate SG-1, Angel, The Inside, NCIS and the 2005 remake of The Poseidon Adventure. He also starred in the ABC series Day Break as Chad Shelten in 2006. Baldwin parodied the Ricky Linderman character in the 2008 film Drillbit Taylor. Baldwin won a SyFy Genre Award in 2006 for Best Supporting Actor/Television for his role as Jayne Cobb in the television series Firefly. Baldwin was cast as Clark Kent/Superman in the first DC animated universe movie, Superman: Doomsday, based on DC Comics' The Death of Superman and is currently co-starring in the NBC television show Chuck as NSA Agent John Casey. ",1962-02-27,,https://twitter.com/AdamBaldwin,1,2023-02-02 07:22:00.65957+00
67,Ludacris,https://www.themoviedb.org/t/p/w300_and_h450_bestv2/erkJijujhe48vhJ8iCEtVpNEeVn.jpg,1,"Christopher Brian Bridges (born September 11, 1977), known professionally as Ludacris, is an American rapper and actor. After forming his own label, Disturbing tha Peace in the late 1990s, Ludacris later signed with Def Jam South and would go on to become one of the first Dirty South rappers to achieve mainstream success with his subsequent releases. For his music, Ludacris has won an MTV Video Music Award and three Grammy Awards. As an actor, Ludacris is best known for his role as Tej Parker in the Fast and Furious film series, with his first appearance in the franchise coming in 2003. His other notable roles include Crash (2004), Gamer (2009), and New Year's Eve (2011). For his performance in the ensemble of Crash, Ludacris was co-awarded a Screen Actors Guild Award and a Critic's Choice Award for Best Cast.",1977-09-11,https://instagram.com/ludacris/,https://twitter.com/Ludacris,1,2023-02-02 07:23:09.682232+00
68,Elsa Pataky,https://www.themoviedb.org/t/p/w300_and_h450_bestv2/VxWaE3qO56PWTt4Hz3HkqrdgTd.jpg,2,"Elsa Lafuente Medianu born 18 July 1976), known professionally as Elsa Pataky, is a Spanish model and actress. Pataky is known for her role as Elena Neves in the Fast & Furious franchise. She has appeared in the films Snakes on a Plane (2006), Giallo (2009) and Give 'Em Hell, Malone (2009). She also starred in the Spanish film Di Di Hollywood (2010).",1976-07-18,https://instagram.com/elsapatakyconfidential/,https://twitter.com/ElsaPataky_,13,2023-02-02 07:28:13.504747+00
69,Elizabeth Olsen,https://www.themoviedb.org/t/p/w300_and_h450_bestv2/wIU675y4dofIDVuhaNWPizJNtep.jpg,2,"Elizabeth Chase Olsen (born February 16, 1989) is an American actress. Born in Sherman Oaks, California, Olsen began acting at age four. She starred in her debut film role in the thriller Martha Marcy May Marlene in 2011, for which she was acclaimed and nominated for a Critics' Choice Movie Award among other accolades, followed by a role in the horror film Silent House. Olsen received a BAFTA Rising Star Award nomination and graduated from New York University two years later.

Olsen gained worldwide recognition for her portrayal of Wanda Maximoff / Scarlet Witch in the Marvel Cinematic Universe media franchise, starring in the superhero films Avengers: Age of Ultron (2015), Captain America: Civil War (2016), Avengers: Infinity War (2018), Avengers: Endgame (2019), and Doctor Strange in the Multiverse of Madness (2022), as well as the miniseries WandaVision (2021). Her performance in WandaVision garnered her nominations for a Primetime Emmy Award and a Golden Globe Award.",1989-02-16,,,1,2023-02-02 07:32:57.67985+00
70,Simon Pegg,https://www.themoviedb.org/t/p/w300_and_h450_bestv2/nOWKXxgADG98RjKyfQ7oSDfns6J.jpg,1,"Simon John Pegg (born 14 February 1970) is an English actor, comedian, screenwriter, and producer. He came to public prominence in the UK as the co-creator of the Channel 4 sitcom Spaced, directed by Edgar Wright. He went on to co-write and star in the Three Flavours Cornetto film trilogy: Shaun of the Dead (2004), Hot Fuzz (2007), and The World's End (2013). He and Nick Frost wrote and starred in the sci-fi film Paul (2011).

Pegg is one of the few performers to have achieved what Radio Times calls ""the Holy Grail of nerd-dom"", playing popular supporting characters in Doctor Who (2005), Star Trek as Montgomery ""Scotty"" Scott (2009–2016), and Star Wars: The Force Awakens (2015). He currently stars as Benji Dunn in the Mission: Impossible film series (2006–present), and he played the Chamberlain in The Dark Crystal: Age of Resistance (2019).",1970-02-14,https://instagram.com/simonpegg/,https://twitter.com/simonpegg,3,2023-02-02 07:44:51.305052+00
71,Ving Rhames,https://www.themoviedb.org/t/p/w300_and_h450_bestv2/4gpLVNKPZlVucc4fT2fSZ7DksTK.jpg,1,"An American actor best known for his work in Bringing Out the Dead, Pulp Fiction, Baby Boy, Don King: Only in America, and the Mission: Impossible film series. Rhames was born in New York City, New York, he entered New York's School of Performing Arts, where he discovered his love of acting. After high school, he studied drama at SUNY Purchase where he met fellow actor Stanley Tucci, who gave him his nickname ""Ving"". He later transferred to Juilliard, where he began his career in New York theater. Rhames first appeared on Broadway in the play The Winter Boys in 1984. Ving continued his rise to fame through his work in soap operas. He found work as a supporting actor, and came to the attention of the general public by playing the role of Marsellus Wallace in Pulp Fiction (1994).",1959-05-12,,,1,2023-02-02 08:03:00.298709+00
72,Jordana Brewster,https://www.themoviedb.org/t/p/w300_and_h450_bestv2/ceL0zxeVbWfCfhoIDZIE1NYqBWb.jpg,2,"Jordana Brewster (born April 26, 1980) is an American actress. She began her acting career with an appearance in the soap opera All My Children (1995). After that, she joined the cast of As the World Turns (1995–2001), as a recurring role, Nikki Munson. She was later cast as one of the main characters in her first film feature film The Faculty (1998). Her role brought her to the attention of a much wider audience. She also landed a starring role in a NBC television miniseries entitled The 60s (1999).

Her breakthrough role came in the action film The Fast and the Furious (2001). Other film roles include the action comedy film D.E.B.S. (2004), the horror film The Texas Chainsaw Massacre: The Beginning (2006), and the fourth and fifth films of the The Fast and the Furious film series, Fast & Furious (2009) and Fast Five (2011). She has appeared as a recurring role in the NBC television series Chuck (2008–2009).",1980-04-26,https://instagram.com/jordanabrewster/,https://twitter.com/JordanaBrewster,14,2023-02-02 08:04:22.518918+00
73,Michelle Rodriguez,https://www.themoviedb.org/t/p/w300_and_h450_bestv2/jxSSvm0MwG7JVpKwRFL1a4mYiic.jpg,2,"Mayte Michelle Rodríguez (born July 12, 1978), known professionally as Michelle Rodriguez, is an American actress, screenwriter, and DJ. She got her breakout role as a troubled boxer in the independent film Girlfight (2000), which was met with critical acclaim and earned her several awards, including the Independent Spirit Award and Gotham Award for Best Debut Performance. The following year, she starred as Letty Ortiz in the blockbuster film The Fast and the Furious (2001), reprising her role in its sequels Fast & Furious (2009), Fast & Furious 6 (2013), and Furious 7 (2015).

During her career, Rodriguez has played tough, independent women in a number of successful action films, such as Blue Crush, S.W.A.T., Battle: Los Angeles, and Avatar. She is also known for her roles as Shé in the action comedy films Machete and Machete Kills, and Rain Ocampo in the science fiction films Resident Evil and Resident Evil: Retribution.",1978-07-12,https://instagram.com/mrodofficial/,https://twitter.com/MRodOfficial,1,2023-02-02 08:05:14.82611+00
74,Tyrese Gibson,https://www.themoviedb.org/t/p/w300_and_h450_bestv2/yxisC8rYPF7JQGR2u3lXo2eMi09.jpg,1,"Tyrese Darnell Gibson (born December 30, 1978), also known mononymously as Tyrese, is an American Grammy-nominated R&B singer, songwriter, actor, author, television producer, former fashion model and MTV VJ. He is best known for his role as Roman Pearce in the The Fast and the Furious series.",1978-12-30,,,1,2023-02-02 08:05:56.935206+00
