id,name,image_url,gender,biography,country_id,created_at
109,Baltasar Kormákur,https://www.themoviedb.org/t/p/w300_and_h450_bestv2/bC9ifwIjsR3VTgJv83Px71mroTl.jpg,1,"Baltasar Kormákur is an Icelandic actor, theater and film director, and film producer. He is best known for directing the films 101 Reykjavík, Hafið, A Little Trip to Heaven (starring Julia Stiles and Forest Whitaker), and a film based on the book Mýrin (Jar City) by Arnaldur Indriðason. His father is the Spanish painter Baltasar Samper.",35,2023-02-15 06:17:08.283644+00
110,Christopher Nolan,https://www.themoviedb.org/t/p/w300_and_h450_bestv2/xuAIuYSmsUzKlUMBFGVZaWsY3DZ.jpg,1,"Christopher Edward Nolan, CBE (born 30 July 1970) is a British-American film director, screenwriter, and producer. He was born in Westminster, London, England and holds both British and American citizenship due to his American mother. He is known for writing and directing critically acclaimed films such as Memento (2000), The Prestige (2006), The Dark Knight Trilogy (2005-12), Inception (2010), Interstellar (2014) and Dunkirk (2017). Nolan is the founder of the production company Syncopy Films. He often collaborates with his wife, producer Emma Thomas, and his brother, screenwriter Jonathan Nolan.",3,2023-02-15 06:23:03.737515+00
111,Matthew Vaughn,https://www.themoviedb.org/t/p/w300_and_h450_bestv2/Dnbz3B7yy4u0abixuD5LakZgsy.jpg,1,"Matthew Allard de Vere Drummond (born Matthew Allard Robert Vaughn; 7 March 1971) is an English filmmaker. He has produced films including Lock, Stock and Two Smoking Barrels (1998) and Snatch (2000), and directed Layer Cake (2004), Stardust (2007), Kick-Ass (2010), X-Men: First Class (2011), Kingsman: The Secret Service (2014) and its sequel Kingsman: The Golden Circle (2017), and produced, co-wrote, and directed its prequel The King's Man (2021).",3,2023-02-15 06:41:10.394422+00
112,Brian Goodman,https://www.themoviedb.org/t/p/w300_and_h450_bestv2/kvRS1QA7YuYhlFO3M8GbnOtvXts.jpg,1,"Brian Goodman is an American film and television director, writer, and actor.",1,2023-02-15 06:56:47.953873+00
113,Anggy Umbara,https://www.themoviedb.org/t/p/w300_and_h450_bestv2/a1Aj4fZFQdqXkcJJMk1TKB09Hkh.jpg,1,"Anggy Umbara is an Indonesian film director, producer and, screenwriter. He is known for making such huge and blockbuster films. His film Warkop DKI Reborn Jangkrik Boss Part 1 is the number one most-watched film of all time in Indonesia.",2,2023-02-15 07:19:54.383184+00
114,Timo Tjahjanto,https://www.themoviedb.org/t/p/w300_and_h450_bestv2/zKU29Poa4gbJTH4GKmTlgJbloc7.jpg,1,"Timo Tjahjanto is an Indonesian film director and screenwriter. Born in 1980, he has been fascinated with film since an early age. He admitted watching Psycho at young age and has left him with “strong impression and somehow transform it into passion.”",8,2023-02-15 07:48:54.361817+00
117,Monty Tiwa,https://www.themoviedb.org/t/p/w300_and_h450_bestv2/4RldJ2ER48GUa9fAm2SvrdrcssL.jpg,1,Monty Tiwa is an Indonesian film director and screenwriter.,2,2023-02-15 07:50:25.777924+00
118,Faozan Rizal,https://www.themoviedb.org/t/p/w300_and_h450_bestv2/zzbV9wj9jZUuhxyRbNwBtp7K6eo.jpg,1,Faozan Rizal is an Indonesian cinematographer and film director.,2,2023-02-15 07:50:53.433625+00
120,Upi Avianto,https://www.themoviedb.org/t/p/w300_and_h450_bestv2/qXVyMaJXP35ZnnPPU9EmZJwu7BC.jpg,2,"Upi Avianto or also known by her first name Upi (born in Jakarta, Indonesia, July 21, 1972) is an Indonesian director and screenwriter.",2,2023-02-15 07:52:13.06058+00
119,Hanung Bramantyo,https://www.themoviedb.org/t/p/w300_and_h450_bestv2/fImb8IlheUIgeOjxVmPijXvPhXR.jpg,1,"Hanung Bramantyo is an Indonesian director known for his films ranging from teen romances to religious dramas.

Bramantyo's works have been noted as covering a variety of genres and political ideologies, with most of his early works being teen romances while his more recent works have been religious dramas. He has also seen controversy for his portrayal of Islam. However, his films have received numerous awards, including two Citra Awards for Best Director at the Indonesian Film Festival.",2,2023-02-15 07:51:19.778314+00
121,Pidi Baiq,,1,"Pidi Baiq (born August 8, 1972) is a multi-talented artist from Indonesia. He is a novelist and book writer, lecturer, illustrator, comic artist, musician and songwriter.",2,2023-02-15 08:21:10.554736+00
122,Rizal Mantovani,https://www.themoviedb.org/t/p/w300_and_h450_bestv2/8qU1WVygBm3nA9kH1OweKffpUSP.jpg,1,"Rizal has a degree in Architecture and started directing music videos in 1992. His work has won him several awards, both domestic and international. To date, he has over 400 music videos under his belt, twelve feature films, several television commercials and numerous music video awards, including an MTV 'Moon Man' for the 1995 MTV ASIA Viewer's Choice award for the video 'Sambutlah' performed by Denada.",2,2023-02-15 08:27:41.257416+00
123,Indra Gunawan,https://www.themoviedb.org/t/p/w300_and_h450_bestv2/1uJagjerVkiWlNIMuU662x4hSrR.jpg,1,"Indra Gunawan is a director from Indonesia. Started his career in 2007 as an assistant director in the film Get Married. His debut as a film director in the film Hijrah Cinta. During his career as a director he has directed films based on novels including Dear Nathan, Dear Nathan: Hello Salma, Serendipity, Senior and #BerhentiDiKamu",2,2023-02-15 08:47:39.09565+00